{
	"uri": "http://cv.iptc.org/newscodes/scene/",
	"type": [
		"http://www.w3.org/2004/02/skos/core#ConceptScheme"
	],
	"prefAlias": "scn",
	"prefLabel": {
		"en-GB": "IPTC Scene NewsCodes"
	},
	"definition": {
		"en-GB": "Indicates a type of scene covered by an item."
	},
	"editorialNote": {"en-GB":"This is a vague reflection of the real IPTC Scene NewsCodes - just for IKOS-scheme testing purposes"},
	"authority": "https://www.iptc.org",
	"licenseLink": "http://creativecommons.org/licenses/by/4.0/",
	"availLang": [
		"en-GB", "de"
	],
	"hasTopConcept": [
		"http://cv.iptc.org/newscodes/scene/010100", "http://cv.iptc.org/newscodes/scene/010200"
	],
	"conceptSet": [
		{
			"uri": "http://cv.iptc.org/newscodes/scene/010100",
			"type": [
				"http://www.w3.org/2004/02/skos/core#Concept", "http://cv.iptc.org/newscodes/cpnature/abstract"
			],
			"qcode": "scn:010100",
			"created": "2008-01-01T01:00:00+00:00",
			"modified": "2015-09-09T00:00:00+00:00",
			"inScheme": [
				"http://cv.iptc.org/newscodes/scene/"
			],
			"topConceptOf": [
				"http://cv.iptc.org/newscodes/scene/"
			],
			"prefLabel": {
				"en-GB": "headshot",
				"de": "Portrait"
			},
			"definition": {
				"en-GB": "A head only view of a person (or animal/s) or persons as in a montage.",
				"de": "Ansicht nur des Kopfes einer oder mehrerer Personen oder von einem oder mehreren Tieren."
			},
			"closeMatch": [
				"https://www.wikidata.org/entity/Q134307"
			]
		}, {
			"uri": "http://cv.iptc.org/newscodes/scene/010200",
			"type": [
				"http://www.w3.org/2004/02/skos/core#Concept", "http://cv.iptc.org/newscodes/cpnature/abstract"
			],
			"qcode": "scn:010200",
			"created": "2008-01-01T01:00:00+00:00",
			"modified": "2015-09-09T00:00:00+00:00",
			"inScheme": [
				"http://cv.iptc.org/newscodes/scene/"
			],
			"topConceptOf": [
				"http://cv.iptc.org/newscodes/scene/"
			],
			"narrower": [
				"http://cv.iptc.org/newscodes/scene/010201"
			],
			"prefLabel": {
				"en-GB": "half-length",
				"de": "Halbfigur"
			},
			"definition": {
				"en-GB": "A torso and head view of a person or persons. ",
				"de": "Ansicht des Oberkörpers einer oder mehrerer Personen."
			}
		}, {
			"uri": "http://cv.iptc.org/newscodes/scene/010201",
			"type": [
				"http://www.w3.org/2004/02/skos/core#Concept", "http://cv.iptc.org/newscodes/cpnature/abstract"
			],
			"qcode":  "scn:010201",
			"created": "2015-09-09T00:00:00+00:00",
			"modified": "2015-09-09T00:00:00+00:00",
			"retired": "2015-09-09T23:59:59+00:00",
			"inScheme": [
				"http://cv.iptc.org/newscodes/scene/"
			],
			"broader": [
				"http://cv.iptc.org/newscodes/scene/010200"
			],
			"prefLabel": {
				"en-GB": "dummy half of half-length",
				"de": "Dummy halbe Halbfigur"
			},
			"definition": {
				"en-GB": "A dummy concept for testing only",
				"de": "Ein Dummy-Begriff, nur für Tests"
			}
		}
	]
}